{
  "schema": "par-beatdown.beat-keys",
  "version": 1,
  "source": {
    "timeline": "song.music.json",
    "fps": 30.0,
    "offset_seconds": 0.0
  },
  "output": {
    "mode": "merge",
    "namespace": "music"
  },
  "bindings": [
    {
      "source": "music.rms",
      "target": "color.brightness",
      "op": "replace",
      "scale": 1.0,
      "offset": 0.0
    }
  ]
}
