{
  "schema": "par-beatdown.beat-keys",
  "version": 1,
  "source": {
    "timeline": "song.music.json",
    "fps": 30.0,
    "offset_seconds": 0.0
  },
  "output": {
    "mode": "overlay",
    "namespace": "music"
  },
  "bindings": [
    {
      "source": "music.rms",
      "target": "camera.zoom",
      "op": "replace",
      "scale": 2.0,
      "offset": 0.0,
      "clamp": {
        "min": 0.0,
        "max": 0.875
      }
    },
    {
      "source": "music.rms",
      "target": "color.brightness",
      "op": "add",
      "scale": 1.0,
      "offset": 0.0
    },
    {
      "source": "music.rms",
      "target": "layer.opacity",
      "op": "multiply",
      "scale": 0.5,
      "offset": 0.25,
      "clamp": {
        "min": 0.0,
        "max": 0.5
      }
    }
  ]
}
